{
  "schema_version": "identity_claim.v1",
  "subject_prefix_hash": "prefix-2001-db8-64-of-a-mind",
  "witness_quorum_required_count": 3,
  "events": [
    {
      "sequence": 0,
      "event_id": "genesis",
      "previous_event_hash": "",
      "commitment": "commit-0",
      "witnesses": [
        {
          "witness_id_hash": "w-progenitor-a",
          "attestation_hash": "att-progenitor-a",
          "signature": "sig-progenitor-a"
        },
        {
          "witness_id_hash": "w-progenitor-b",
          "attestation_hash": "att-progenitor-b",
          "signature": "sig-progenitor-b"
        }
      ],
      "event_hash": "3b40524ece489fe29a55cf41cbfdbf4e4aad2b60c2f7ab60d9152ccba985076e"
    },
    {
      "sequence": 1,
      "event_id": "met-carol",
      "previous_event_hash": "3b40524ece489fe29a55cf41cbfdbf4e4aad2b60c2f7ab60d9152ccba985076e",
      "commitment": "commit-1",
      "witnesses": [
        {
          "witness_id_hash": "w-carol",
          "attestation_hash": "att-carol",
          "signature": "sig-carol"
        }
      ],
      "event_hash": "be499d8e8d0b5256f87733ee3074bfa24c064bdf70f5fc516825de5998d2ef85"
    },
    {
      "sequence": 2,
      "event_id": "met-dave",
      "previous_event_hash": "be499d8e8d0b5256f87733ee3074bfa24c064bdf70f5fc516825de5998d2ef85",
      "commitment": "commit-2",
      "witnesses": [
        {
          "witness_id_hash": "w-dave",
          "attestation_hash": "att-dave",
          "signature": "sig-dave"
        }
      ],
      "event_hash": "00e7975f5c93fd7b79f01065be447e86f8c179288917b2fd1045261ad3551125"
    }
  ]
}
